Id,Tickers,Analysis,Cleaned Analysis,VADER Compound,VADER Positive,VADER Negative,VADER Neutral,TextBlob Subjectivity,TextBlob Polarity,Weights VADER Compound,Weights VADER Positive,Weights TextBlob Polarity
7,JNJ,"Johnson & Johnson is a diversified healthcare company with multiple business segments. In 2018, the company reported total sales of $81.6 billion. This increased to $82.1 billion in 2019, reflecting modest growth. In 2020, revenues rose significantly to $82.6 billion, driven in part by increased demand for pharmaceutical and consumer health products during the COVID-19 pandemic.
Johnson & Johnson's net income showed variations during these years. In 2018, the company reported a net income of $15.3 billion, which decreased slightly to $15.1 billion in 2019. In 2020, net income rebounded to $14.7 billion, primarily due to increased sales.
The company's earnings per share also followed a similar pattern. In 2018, the EPS was $5.61, which decreased to $5.61 in 2019 and further declined to $5.39 in 2020.
JNJ's stock price exhibited relatively stable performance during this period, reflecting the company's position as a leading healthcare and pharmaceutical conglomerate. While there were fluctuations, the stock generally maintained its value.
Johnson & Johnson is known for its consistent and growing dividend payments. The company increased its quarterly dividend during these years, which is appealing to income-focused investors. Johnson & Johnson operates in three primary business segments: pharmaceuticals, medical devices, and consumer health. This diversified portfolio helps mitigate risks associated with any one segment and allows for stability and growth potential.
The pharmaceutical segment of JNJ has been a significant driver of revenue and growth. The company has a robust pipeline of drugs and treatments, contributing to its financial performance.
Johnson & Johnson's consumer health products include well-known brands like Tylenol, Band-Aid, and Neutrogena. These products often demonstrate stability and demand, even during economic downturns.
The medical devices segment provides a range of medical equipment and devices, contributing to the company's diversified revenue streams.
During the COVID-19 pandemic, Johnson & Johnson played a critical role by developing and distributing a COVID-19 vaccine, which contributed to its financial results in 2020.
Like many healthcare companies, Johnson & Johnson faced legal and regulatory challenges, including lawsuits related to its talc products and opioids. These challenges can impact the company's reputation and financial results.",johnson johnson diversify healthcare company multiple business segment 2018 company report total sale 816 billion increase 821 billion 2019 reflect modest growth 2020 revenue rise significantly 826 billion drive part increase demand pharmaceutical consumer health product covid19 pandemic johnson johnson net income show variation year 2018 company report net income 153 billion decrease slightly 151 billion 2019 2020 net income rebound 147 billion primarily due increase sale company earn per share also follow similar pattern 2018 eps 561 decrease 561 2019 decline 539 2020 jnjs stock price exhibit relatively stable performance period reflect company position lead healthcare pharmaceutical conglomerate fluctuation stock generally maintain value johnson johnson know consistent grow dividend payment company increase quarterly dividend year appeal incomefocused investor johnson johnson operate three primary business segment pharmaceutical medical device consumer health diversify portfolio help mitigate risk associate one segment allow stability growth potential pharmaceutical segment jnj significant driver revenue growth company robust pipeline drug treatment contribute financial performance johnson johnson consumer health product include wellknown brand like tylenol bandaid neutrogena product often demonstrate stability demand even economic downturn medical device segment provide range medical equipment device contribute company diversify revenue stream covid19 pandemic johnson johnson play critical role develop distribute covid19 vaccine contribute financial result 2020 like many healthcare company johnson johnson face legal regulatory challenge include lawsuit relate talc product opioids challenge impact company reputation financial result,0.9814,0.172,0.036,0.792,0.318910256,0.083012821,0.06596,0.04576,0.04801
8,V,"Visa is a global payments technology company. In 2018, the company reported net operating revenue of $20.6 billion. This increased to $22.9 billion in 2019, reflecting solid growth. In 2020, despite the challenges of the COVID-19 pandemic, Visa's revenue reached $21.8 billion.
Visa's net income showed variations during these years. In 2018, the company reported a net income of $10.3 billion, which increased to $12.1 billion in 2019. However, in 2020, net income decreased to $10.9 billion, primarily due to the pandemic's impact on global economic activity.
The company's earnings per share also followed a similar pattern. In 2018, the EPS was $4.42, which increased to $5.32 in 2019 and decreased to $4.96 in 2020.
Visa's stock price exhibited strong performance during this period, reflecting its position as a leader in the global payments industry. The stock reached new highs, making Visa one of the most valuable financial services companies.
Visa is known for its consistent dividend payments and dividend growth. The company increased its quarterly dividend during these years, which is attractive to income-focused investors.
Visa operates one of the largest global payments networks, facilitating electronic funds transfers and payment processing for millions of businesses and consumers worldwide.
Visa benefited from the ongoing shift from cash to digital payments during this period. The increasing adoption of e-commerce and mobile payments contributed to the company's growth.
Visa forged strategic partnerships and made acquisitions to expand its presence in the payments ecosystem. For example, the acquisition of Plaid in 2020 aimed to enhance Visa's capabilities in connecting consumers' bank accounts to fintech apps.
While Visa's business was impacted by reduced travel and spending during the pandemic, the company adapted by focusing on digital and contactless payments, which gained importance during social distancing measures. Visa operates in a highly regulated industry, which can impact its operations and profitability. Changes in regulations can affect transaction fees and business practices.
Visa faces competition from other payment networks like Mastercard, as well as emerging fintech companies and digital payment platforms.",visa global payment technology company 2018 company report net operate revenue 206 billion increase 229 billion 2019 reflect solid growth 2020 despite challenge covid19 pandemic visa revenue reach 218 billion visa net income show variation year 2018 company report net income 103 billion increase 121 billion 2019 however 2020 net income decrease 109 billion primarily due pandemic impact global economic activity company earn per share also follow similar pattern 2018 eps 442 increase 532 2019 decrease 496 2020 visa stock price exhibit strong performance period reflect position leader global payment industry stock reach new high make visa one valuable financial service company visa know consistent dividend payment dividend growth company increase quarterly dividend year attractive incomefocused investor visa operate one largest global payment network facilitate electronic fund transfer payment process million business consumer worldwide visa benefit ongoing shift cash digital payment period increase adoption ecommerce mobile payment contribute company growth visa forge strategic partnership make acquisition expand presence payment ecosystem example acquisition plaid 2020 aim enhance visa capability connect consumer bank account fintech apps visa business impact reduce travel spend pandemic company adapt focus digital contactless payment gain importance social distance measure visa operate highly regulate industry impact operation profitability change regulation affect transaction fee business practice visa face competition payment network like mastercard well emerge fintech company digital payment platform,0.9919,0.209,0.005,0.787,0.202588933,0.089044796,0.06666,0.0556,0.0515
9,JPM,"JPMorgan Chase is one of the largest financial institutions in the world. In 2018, the company reported total net revenue of $109.0 billion. This increased to $115.6 billion in 2019, reflecting solid growth. In 2020, despite the economic challenges posed by the COVID-19 pandemic, revenues reached $122.9 billion.
JPMorgan Chase's net income also showed variations during these years. In 2018, the company reported a net income of $32.5 billion, which increased to $36.4 billion in 2019. In 2020, net income decreased to $29.1 billion, primarily due to the pandemic's impact on the economy.
The company's earnings per share followed a similar pattern. In 2018, the EPS was $9.00, which increased to $10.72 in 2019 and decreased to $8.52 in 2020.
JPM's stock price exhibited variations during this period, reflecting the broader economic conditions and the impact of the pandemic on financial markets. The stock remained a significant component of the financial sector.
JPMorgan Chase is known for its consistent dividend payments and dividend growth. However, during the pandemic, the Federal Reserve temporarily restricted dividend payments for major banks, including JPM, to conserve capital.
JPMorgan Chase offers a wide range of financial services, including banking, asset management, investment banking, and consumer lending. The company's diversification helps it navigate economic cycles.
The consumer banking segment is a significant part of JPM's business, providing services like checking and savings accounts, mortgages, and credit cards. The bank has a large retail presence, serving millions of consumers.
JPMorgan Chase is a leader in investment banking, providing advisory services, underwriting, and trading services to corporations and institutions globally.
The company's asset management division manages assets for both institutional and individual clients, contributing to its diversified revenue streams.
JPMorgan Chase, like other financial institutions, adapted to the pandemic by implementing remote work arrangements and assisting customers and businesses impacted by the economic fallout.
The financial industry is highly regulated, and changes in regulations can impact JPM's operations and profitability. Compliance with regulatory requirements is a critical aspect of the company's operations.
JPMorgan Chase faces competition from other large banks, regional banks, and fintech companies. The financial sector is highly competitive, with companies vying for market share and customer loyalty.",jpmorgan chase one largest financial institution world 2018 company report total net revenue 1090 billion increase 1156 billion 2019 reflect solid growth 2020 despite economic challenge pose covid19 pandemic revenue reach 1229 billion jpmorgan chase net income also show variation year 2018 company report net income 325 billion increase 364 billion 2019 2020 net income decrease 291 billion primarily due pandemic impact economy company earn per share follow similar pattern 2018 eps 900 increase 1072 2019 decrease 852 2020 jpms stock price exhibit variation period reflect broader economic condition impact pandemic financial market stock remain significant component financial sector jpmorgan chase know consistent dividend payment dividend growth however pandemic federal reserve temporarily restrict dividend payment major bank include jpm conserve capital jpmorgan chase offer wide range financial service include bank asset management investment bank consumer lend company diversification help navigate economic cycle consumer bank segment significant part jpms business provide service like check save account mortgage credit card bank large retail presence serve million consumer jpmorgan chase leader investment bank provide advisory service underwrite trade service corporation institution globally company asset management division manage asset institutional individual client contribute diversify revenue stream jpmorgan chase like financial institution adapt pandemic implement remote work arrangement assist customer business impact economic fallout financial industry highly regulate change regulation impact jpms operation profitability compliance regulatory requirement critical aspect company operation jpmorgan chase face competition large bank regional bank fintech company financial sector highly competitive company vie market share customer loyalty,0.9893,0.185,0.022,0.793,0.270691964,0.071439732,0.06649,0.04922,0.04131
10,PG,"Procter & Gamble is a consumer goods company known for its wide range of products. In 2018, the company reported net sales of $66.8 billion. This increased to $67.7 billion in 2019, reflecting modest growth. In 2020, despite economic challenges posed by the COVID-19 pandemic, revenues further increased to $71.0 billion.
Procter & Gamble's net income showed variations during these years. In 2018, the company reported a net income of $12.9 billion, which increased to $15.3 billion in 2019. In 2020, net income reached $13.9 billion, reflecting the impact of the pandemic on certain product categories.
The company's earnings per share also followed a similar pattern. In 2018, the EPS was $4.22, which increased to $5.59 in 2019 and decreased to $5.20 in 2020.
PG's stock price exhibited relatively stable performance during this period, reflecting the company's reputation for providing essential consumer products and its position as a defensive stock. The stock generally maintained its value.
Procter & Gamble is known for its consistent dividend payments and long history of dividend increases. The company increased its quarterly dividend during these years, appealing to income-focused investors.
Procter & Gamble manufactures and markets a wide range of consumer products, including brands like Pampers, Tide, Gillette, and Crest. This diversification helps mitigate risks associated with any one product category.
PG operates in the consumer staples sector, which tends to be less cyclical and more defensive during economic downturns. Consumer staples products are considered essential, and demand for them is relatively stable.
During the COVID-19 pandemic, Procter & Gamble's products, especially cleaning and personal hygiene products, experienced increased demand. The company adapted to the situation by ramping up production and ensuring product availability.
Procter & Gamble faces competition from other consumer goods companies, both large and small. The consumer goods industry is competitive, with companies constantly innovating and marketing their products to consumers.
PG has been actively working on sustainability and environmental initiatives, which align with changing consumer preferences and regulatory trends.
Procter & Gamble has a significant global presence, which exposes it to currency exchange rate fluctuations and geopolitical risks.",procter gamble consumer good company know wide range product 2018 company report net sale 668 billion increase 677 billion 2019 reflect modest growth 2020 despite economic challenge pose covid19 pandemic revenue increase 710 billion procter gamble net income show variation year 2018 company report net income 129 billion increase 153 billion 2019 2020 net income reach 139 billion reflect impact pandemic certain product category company earn per share also follow similar pattern 2018 eps 422 increase 559 2019 decrease 520 2020 pgs stock price exhibit relatively stable performance period reflect company reputation provide essential consumer product position defensive stock stock generally maintain value procter gamble know consistent dividend payment long history dividend increase company increase quarterly dividend year appeal incomefocused investor procter gamble manufacture market wide range consumer product include brand like pamper tide gillette crest diversification help mitigate risk associate one product category pg operate consumer staple sector tend le cyclical defensive economic downturn consumer staple product consider essential demand relatively stable covid19 pandemic procter gamble product especially clean personal hygiene product experience increase demand company adapt situation ramp production ensure product availability procter gamble face competition consumer good company large small consumer good industry competitive company constantly innovate market product consumer pg actively work sustainability environmental initiative align change consumer preference regulatory trend procter gamble significant global presence expose currency exchange rate fluctuation geopolitical risk,0.9921,0.232,0.038,0.73,0.36408046,0.131157635,0.06667,0.06172,0.07585
11,WMT,"Walmart is one of the world's largest retail companies. In 2018, the company reported total revenue of $500.3 billion. This increased to $514.4 billion in 2019, reflecting steady growth. In 2020, amid the challenges posed by the COVID-19 pandemic, revenues surged to $559.2 billion as consumers increased their spending on essential items.
Walmart's net income also showed variations during these years. In 2018, the company reported a net income of $9.9 billion, which increased to $14.9 billion in 2019. In 2020, net income reached $13.5 billion, reflecting the impact of pandemic-related expenses.
The company's earnings per share followed a similar pattern. In 2018, the EPS was $3.28, which increased to $5.01 in 2019 and decreased to $4.75 in 2020.
WMT's stock price exhibited strong performance during this period, reflecting the company's position as a leading retailer and its status as a defensive stock. The stock generally maintained its value and saw gains, especially during the pandemic.
Walmart is known for its consistent dividend payments and dividend growth. The company increased its dividend during these years, making it appealing to income-focused investors.
Walmart operates a diverse portfolio of retail formats, including supercenters, warehouse clubs, and e-commerce. This diversification helps it cater to a wide range of consumer needs.
Walmart's e-commerce business experienced significant growth during this period. The company invested in expanding its online presence and grocery delivery services to compete with online retailers.
During the COVID-19 pandemic, Walmart's stores and online platform played a crucial role in supplying essential goods and groceries to consumers. The company adapted to the situation by implementing safety measures and expanding online fulfillment capabilities.
Walmart faces competition from both traditional retailers and e-commerce giants like Amazon. The retail industry is highly competitive, and companies must continuously innovate to maintain their market share.
Walmart has a significant global presence, with operations in multiple countries. This exposes the company to currency exchange rate fluctuations and geopolitical risks.
Walmart has been actively working on sustainability and environmental initiatives, which align with changing consumer preferences and regulatory trends.
Walmart has been investing in technology, including artificial intelligence and data analytics, to improve its supply chain efficiency and customer experience.",walmart one world largest retail company 2018 company report total revenue 5003 billion increase 5144 billion 2019 reflect steady growth 2020 amid challenge pose covid19 pandemic revenue surge 5592 billion consumer increase spend essential item walmarts net income also show variation year 2018 company report net income 99 billion increase 149 billion 2019 2020 net income reach 135 billion reflect impact pandemicrelated expense company earn per share follow similar pattern 2018 eps 328 increase 501 2019 decrease 475 2020 wmts stock price exhibit strong performance period reflect company position lead retailer status defensive stock stock generally maintain value saw gain especially pandemic walmart know consistent dividend payment dividend growth company increase dividend year make appeal incomefocused investor walmart operate diverse portfolio retail format include supercenters warehouse club ecommerce diversification help cater wide range consumer need walmarts ecommerce business experience significant growth period company invest expand online presence grocery delivery service compete online retailer covid19 pandemic walmarts store online platform play crucial role supply essential good grocery consumer company adapt situation implement safety measure expand online fulfillment capability walmart face competition traditional retailer ecommerce giant like amazon retail industry highly competitive company must continuously innovate maintain market share walmart significant global presence operation multiple country expose company currency exchange rate fluctuation geopolitical risk walmart actively work sustainability environmental initiative align change consumer preference regulatory trend walmart invest technology include artificial intelligence data analytics improve supply chain efficiency customer experience,0.9957,0.267,0.013,0.72,0.515555556,0.069861111,0.06692,0.07103,0.0404
