Id,Tickers,Analysis,Cleaned Analysis,VADER Compound,VADER Positive,VADER Negative,VADER Neutral,TextBlob Subjectivity,TextBlob Polarity,Weights VADER Compound,Weights VADER Positive,Weights TextBlob Polarity
12,MA,"Mastercard is a global payments technology company. In 2018, the company reported net revenue of $15.0 billion. This increased to $16.9 billion in 2019, reflecting solid growth. In 2020, despite the economic challenges posed by the COVID-19 pandemic, revenues reached $15.3 billion.
Mastercard's net income showed variations during these years. In 2018, the company reported a net income of $6.4 billion, which increased to $8.1 billion in 2019. In 2020, net income decreased to $6.4 billion, primarily due to the pandemic's impact on global economic activity.
The company's earnings per share also followed a similar pattern. In 2018, the EPS was $6.40, which increased to $7.87 in 2019 and decreased to $6.36 in 2020.
MA's stock price exhibited variations during this period, reflecting the broader economic conditions and the impact of the pandemic on financial markets. The stock generally maintained its value and remained a significant component of the financial sector.
Mastercard is known for its consistent dividend payments and modest dividend growth. The company increased its quarterly dividend during these years, which can be attractive to income-focused investors.
Mastercard operates one of the largest global payments networks, facilitating electronic funds transfers and payment processing for millions of businesses and consumers worldwide.
Mastercard benefited from the ongoing shift from cash to digital payments during this period. The increasing adoption of e-commerce, contactless payments, and mobile wallets contributed to the company's growth.
During the COVID-19 pandemic, Mastercard adapted to changing consumer behavior by promoting contactless payments and digital transactions. The company also facilitated philanthropic efforts to support relief efforts.
Mastercard faces competition from other payment networks like Visa, as well as emerging fintech companies and digital payment platforms. The payments industry is highly competitive, with companies vying for market share and innovation.
The financial industry, including payments networks, is subject to regulation, which can impact operations and profitability. Compliance with regulatory requirements is essential for the company.
Mastercard has been actively working on sustainability and environmental initiatives, which align with changing consumer preferences and regulatory trends. Mastercard has been investing in technology, including artificial intelligence and data analytics, to improve its payment processing capabilities and enhance security.",mastercard global payment technology company 2018 company report net revenue 150 billion increase 169 billion 2019 reflect solid growth 2020 despite economic challenge pose covid19 pandemic revenue reach 153 billion mastercards net income show variation year 2018 company report net income 64 billion increase 81 billion 2019 2020 net income decrease 64 billion primarily due pandemic impact global economic activity company earn per share also follow similar pattern 2018 eps 640 increase 787 2019 decrease 636 2020 ma stock price exhibit variation period reflect broader economic condition impact pandemic financial market stock generally maintain value remain significant component financial sector mastercard know consistent dividend payment modest dividend growth company increase quarterly dividend year attractive incomefocused investor mastercard operate one largest global payment network facilitate electronic fund transfer payment process million business consumer worldwide mastercard benefit ongoing shift cash digital payment period increase adoption ecommerce contactless payment mobile wallet contribute company growth covid19 pandemic mastercard adapt change consumer behavior promote contactless payment digital transaction company also facilitate philanthropic effort support relief effort mastercard face competition payment network like visa well emerge fintech company digital payment platform payment industry highly competitive company vie market share innovation financial industry include payment network subject regulation impact operation profitability compliance regulatory requirement essential company mastercard actively work sustainability environmental initiative align change consumer preference regulatory trend mastercard invest technology include artificial intelligence data analytics improve payment process capability enhance security,0.995,0.244,0.004,0.752,0.268045977,0.045172414,0.06687,0.06491,0.02612
13,UNH,"UnitedHealth Group is one of the largest healthcare companies in the world. In 2018, the company reported total revenues of $226.2 billion. This increased to $242.2 billion in 2019, reflecting solid growth. In 2020, amid the challenges posed by the COVID-19 pandemic, revenues reached $257.1 billion.
UnitedHealth Group's net income showed consistent growth during these years. In 2018, the company reported a net income of $12.2 billion, which increased to $13.8 billion in 2019 and further improved to $15.4 billion in 2020.
The company's earnings per share also followed a similar pattern. In 2018, the EPS was $12.51, which increased to $14.30 in 2019 and further improved to $16.22 in 2020.
UNH's stock price exhibited strong performance during this period, reflecting the company's leadership in the healthcare and insurance sectors. The stock generally maintained its value and saw gains, especially during the pandemic.
UnitedHealth Group is known for its consistent dividend payments and dividend growth. The company increased its quarterly dividend during these years, which can be attractive to income-focused investors.
UnitedHealth Group operates a diverse portfolio of healthcare businesses, including UnitedHealthcare, Optum, and its health services division. This diversification helps mitigate risks associated with any one segment.
UnitedHealthcare is one of the largest health insurance providers in the United States. The health insurance segment is a significant part of the company's business.
Optum provides a wide range of healthcare services, including pharmacy benefits management, healthcare consulting, and data analytics. It contributes to the company's diversified revenue streams.
During the COVID-19 pandemic, UnitedHealth Group played a critical role in providing healthcare services, telehealth, and support to communities in need.
UnitedHealth Group faces competition in both the health insurance and healthcare services sectors. The healthcare industry is highly competitive, with companies striving to provide high-quality care and innovative solutions.
The healthcare industry is subject to extensive regulation, which can impact operations and profitability. Compliance with healthcare regulations is essential for the company.
UnitedHealth Group has made strategic acquisitions and expanded its footprint in various healthcare segments, positioning itself for growth and diversification.",unitedhealth group one largest healthcare company world 2018 company report total revenue 2262 billion increase 2422 billion 2019 reflect solid growth 2020 amid challenge pose covid19 pandemic revenue reach 2571 billion unitedhealth group net income show consistent growth year 2018 company report net income 122 billion increase 138 billion 2019 improve 154 billion 2020 company earn per share also follow similar pattern 2018 eps 1251 increase 1430 2019 improve 1622 2020 unhs stock price exhibit strong performance period reflect company leadership healthcare insurance sector stock generally maintain value saw gain especially pandemic unitedhealth group know consistent dividend payment dividend growth company increase quarterly dividend year attractive incomefocused investor unitedhealth group operate diverse portfolio healthcare business include unitedhealthcare optum health service division diversification help mitigate risk associate one segment unitedhealthcare one largest health insurance provider unite state health insurance segment significant part company business optum provide wide range healthcare service include pharmacy benefit management healthcare consult data analytics contribute company diversify revenue stream covid19 pandemic unitedhealth group play critical role provide healthcare service telehealth support community need unitedhealth group face competition health insurance healthcare service sector healthcare industry highly competitive company strive provide highquality care innovative solution healthcare industry subject extensive regulation impact operation profitability compliance healthcare regulation essential company unitedhealth group make strategic acquisition expand footprint various healthcare segment position growth diversification,0.9952,0.266,0.017,0.717,0.50325,0.127583333,0.06688,0.07076,0.07378
14,HD,"Home Depot is one of the largest home improvement retailers in the world. In 2018, the company reported total revenues of $108.2 billion. This increased to $110.2 billion in 2019, reflecting steady growth. In 2020, amid the challenges posed by the COVID-19 pandemic, revenues surged to $132.1 billion as consumers increased spending on home improvement projects.
Home Depot's net income showed variations during these years. In 2018, the company reported a net income of $11.1 billion, which increased to $11.2 billion in 2019. In 2020, net income reached $12.9 billion, reflecting the impact of increased demand during the pandemic.
The company's earnings per share also followed a similar pattern. In 2018, the EPS was $9.73, which increased to $10.25 in 2019 and further improved to $11.94 in 2020.
HD's stock price exhibited strong performance during this period, reflecting the company's leadership in the home improvement retail sector. The stock generally maintained its value and saw gains, especially during the pandemic.
Home Depot is known for its consistent dividend payments and dividend growth. The company increased its quarterly dividend during these years, which can be attractive to income-focused investors.
Home Depot operates a vast network of home improvement stores, providing a wide range of products and services to consumers and contractors.
During the COVID-19 pandemic, Home Depot experienced increased demand as consumers spent more time at home and invested in home improvement projects. The company implemented safety measures and adapted its operations to meet customer needs during the pandemic.
Home Depot invested in its online platform and e-commerce capabilities, which became crucial during the pandemic. The company's online sales saw significant growth during this period.
Home Depot faces competition from other home improvement retailers like Lowe's, as well as online marketplaces and local hardware stores. The home improvement retail industry is competitive, with companies striving to offer a wide range of products and excellent customer service.
Home Depot's operations depend on efficient supply chain and inventory management. Managing inventory levels and ensuring product availability are critical for the company.
Home Depot serves both do-it-yourself (DIY) customers and professional contractors. Catering to the needs of both segments is important for the company's success.
Homeownership trends and the overall health of the housing market can impact Home Depot's business. A strong housing market often leads to increased spending on home improvement.",home depot one largest home improvement retailer world 2018 company report total revenue 1082 billion increase 1102 billion 2019 reflect steady growth 2020 amid challenge pose covid19 pandemic revenue surge 1321 billion consumer increase spend home improvement project home depot net income show variation year 2018 company report net income 111 billion increase 112 billion 2019 2020 net income reach 129 billion reflect impact increase demand pandemic company earn per share also follow similar pattern 2018 eps 973 increase 1025 2019 improve 1194 2020 hds stock price exhibit strong performance period reflect company leadership home improvement retail sector stock generally maintain value saw gain especially pandemic home depot know consistent dividend payment dividend growth company increase quarterly dividend year attractive incomefocused investor home depot operate vast network home improvement store provide wide range product service consumer contractor covid19 pandemic home depot experience increase demand consumer spend time home invest home improvement project company implement safety measure adapt operation meet customer need pandemic home depot invest online platform ecommerce capability become crucial pandemic company online sale saw significant growth period home depot face competition home improvement retailer like low well online marketplace local hardware store home improvement retail industry competitive company strive offer wide range product excellent customer service home depot operation depend efficient supply chain inventory management manage inventory level ensure product availability critical company home depot serve doityourself diy customer professional contractor cater need segment important company success homeownership trend overall health house market impact home depot business strong house market often lead increase spend home improvement,0.9977,0.306,0.023,0.671,0.509666667,0.164333333,0.06705,0.0814,0.09504
15,INTC,"In 2018, Intel reported total revenues of $70.8 billion. This increased to $72.0 billion in 2019, reflecting modest growth. However, in 2020, revenues dipped to $77.9 billion, partly due to the economic challenges posed by the COVID-19 pandemic.
Intel's net income showed variations during these years. In 2018, the company reported a net income of $21.0 billion, which decreased slightly to $21.0 billion in 2019. In 2020, net income increased to $20.9 billion despite the pandemic's impact.
The company's earnings per share also followed a similar pattern. In 2018, the EPS was $4.48, which remained stable at $4.42 in 2019 and increased slightly to $4.94 in 2020.
INTC's stock price exhibited variations during this period, reflecting changes in market sentiment and competition in the semiconductor industry. The stock generally maintained its value but faced challenges.
Intel is known for its consistent dividend payments and dividend growth. The company increased its quarterly dividend during these years, which can be attractive to income-focused investors.
Intel is a leading player in the semiconductor industry, manufacturing a wide range of microprocessors and other semiconductor products for various applications, including data centers and personal computing.
Intel faces intense competition in the semiconductor market from companies like AMD, NVIDIA, and others. The industry is highly competitive, with rapid technological advancements and changing market dynamics.
Intel has a history of technological innovation, but it faced delays in its 10nm chip production during this period, which impacted its competitive position.
Intel's data center segment is a significant part of its business, providing chips for servers and cloud computing. Demand for data center products remained strong during this period.
Intel also serves the personal computing market, providing processors for laptops and desktops. The PC market saw fluctuations during these years, with periods of growth and decline.
Intel, like other tech companies, adapted to remote work arrangements and changing customer needs during the pandemic. The company also invested in technology to support pandemic-related initiatives.
Intel continues to invest heavily in research and development to remain competitive and develop cutting-edge technologies.",2018 intel report total revenue 708 billion increase 720 billion 2019 reflect modest growth however 2020 revenue dip 779 billion partly due economic challenge pose covid19 pandemic intels net income show variation year 2018 company report net income 210 billion decrease slightly 210 billion 2019 2020 net income increase 209 billion despite pandemic impact company earn per share also follow similar pattern 2018 eps 448 remain stable 442 2019 increase slightly 494 2020 intcs stock price exhibit variation period reflect change market sentiment competition semiconductor industry stock generally maintain value face challenge intel know consistent dividend payment dividend growth company increase quarterly dividend year attractive incomefocused investor intel lead player semiconductor industry manufacture wide range microprocessor semiconductor product various application include data center personal compute intel face intense competition semiconductor market company like amd nvidia others industry highly competitive rapid technological advancement change market dynamic intel history technological innovation face delay 10nm chip production period impact competitive position intels data center segment significant part business provide chip server cloud compute demand data center product remain strong period intel also serve personal compute market provide processor laptop desktop pc market saw fluctuation year period growth decline intel like tech company adapt remote work arrangement change customer need pandemic company also invest technology support pandemicrelated initiative intel continue invest heavily research development remain competitive develop cuttingedge technology,0.9905,0.209,0.015,0.776,0.389753086,0.052222222,0.06657,0.0556,0.0302
